<?xml version="1.0" encoding="UTF-8"?>
<result xmlns="http://c3.aphreet.org/rest/1.0"
        xsi:schemaLocation="http://c3.aphreet.org/rest/1.0 http://c3-system.googlecode.com/files/rest.xsd"
        xmlns:xsi="http://www.w3.org/2001/XMLSchema-instance">
    <version>1.0</version>
    <resource address="my_resource_address" createDate="2011-02-07 17:55:10.836 MSK" trackVersions="false">
        <metadata>
            <element key="md_key">
                <value>sdsd</value>
            </element>
            <element key="md_key2">
                <value>md&quot;value2</value>
            </element>
        </metadata>
        <systemMetadata/>
        <versions>
            <version date="2011-02-07 17:55:11.55 MSK">
                <systemMetadata>
                    <element key="sys_key">
                        <value>sys_value</value>
                    </element>
                </systemMetadata>
            </version>
        </versions>
    </resource>
</result>